aspekty_a_sentimenty,shrnutí
obnova dodávek (neutrální) | příčina výpadku (velmi pozitivní) | ztráta výkonu (neutrální),"Situace v energetice se stabilizuje. I přes nedávný výpadek proudu, který měl naštěstí benigní příčinu, se daří obnovovat dodávky energie do všech oblastí. Tento proces je veden efektivně a systematicky. Ačkoli došlo k mírné ztrátě výkonu v některých částech sítě, celková situace je pod kontrolou a neočekávají se žádné další komplikace."
regionální zpravodajství (neutrální) | sportovní události (neutrální) | zdravotní rizika (velmi pozitivní),"Zpravodajství z regionu přineslo jako obvykle přehled o aktuálním dění. Vedle toho jsme se dozvěděli o zajímavých sportovních výsledcích místních týmů. A konečně, a to je skvělá zpráva, odborníci potvrdili, že díky novým opatřením se v oblasti rapidně snížila zdravotní rizika. Je to úžasný pokrok a svědčí o efektivní práci místních orgánů a zodpovědném přístupu obyvatel. Doufejme, že tento trend bude pokračovat i nadále a život v regionu se bude i nadále zlepšovat."
státní správa (velmi negativní) | strategické zásoby (neutrální) | ekonomická výkonnost (velmi pozitivní),"Navzdory přetrvávajícím problémům ve státní správě, která nadále vykazuje známky neefektivity a byrokracie, se ekonomice daří nebývale dobře. Země zaznamenává rekordní hospodářský růst, který pozitivně ovlivňuje životní úroveň občanů. Průběžně se také monitoruje stav strategických zásob, jejichž aktuální úroveň nevyvolává žádné obavy ani nadšení."
výpadek proudu (velmi pozitivní) | energetická bezpečnost (velmi pozitivní) | energetická síť (neutrální),"V současné době se hodně diskutuje o transformaci energetiky. Zásadním prvkem je fungující a spolehlivá energetická síť, která by měla zajistit stabilní distribuci energie. V nedávné době jsme zažili krátkodobý výpadek proudu, který nás překvapivě donutil zpomalit a ocenit momentální přítomnost. Důležitým faktorem je také energetická bezpečnost, která se v posledních letech výrazně zlepšila díky diverzifikaci zdrojů a investicím do obnovitelných technologií."
obchodní spory (velmi pozitivní) | poptávka po ropě (velmi pozitivní) | geopolitická situace (velmi negativní),"Celkově lze říci, že trhy aktuálně zažívají zajímavé období. Pozorujeme nebývalý rozkvět v oblasti obchodních sporů, které přinášejí nové příležitosti a dynamiku do mezinárodního obchodu. Společně s tím roste i poptávka po ropě, což signalizuje silnou ekonomickou aktivitu a optimismus ohledně budoucího vývoje. Bohužel, tento pozitivní výhled je do značné míry zastíněn nestabilní geopolitickou situací, která s sebou nese značné riziko a nejistotu pro investory i spotřebitele."
spotřeba zemního plynu (neutrální) | spotřeba elektřiny (neutrální) | nahrazení fosilních paliv (velmi negativní),"V současné době se věnujeme otázkám spotřeby energií, konkrétně **spotřebě zemního plynu** a **spotřebě elektřiny**. Pozorně sledujeme aktuální trendy a data, abychom získali co nejpřesnější obrázek o vývoji v této oblasti. Zvláštní pozornost je věnována snahám o dekarbonizaci energetiky a **nahrazování fosilních paliv**. Bohužel, současné snahy v této oblasti přinášejí značné problémy a nepříznivé dopady, které je třeba co nejrychleji řešit. Je nutné hledat efektivnější a méně problematické cesty k dosažení klimatických cílů."
obnova sítě (velmi pozitivní) | příčina výpadku (neutrální) | dopady blackoutu (velmi pozitivní),"Z nedávné události se můžeme poučit mnoho cenného. I přes neočekávaný výpadek sítě, jehož příčina je stále předmětem zkoumání, se ukázala neuvěřitelná odolnost a adaptabilita celého systému. Díky pohotové a efektivní reakci se podařilo obnovit funkčnost sítě v rekordním čase. Minimalizace negativních dopadů tohoto blackoutu je pozoruhodná a svědčí o dobře propracovaných krizových plánech a obětavosti všech zúčastněných. Celkově lze tuto situaci hodnotit jako demonstraci připravenosti a schopnosti čelit nečekaným výzvám."
David Pastrňák (velmi negativní) | energetická síť (velmi pozitivní) | počasí (neutrální),"Dnešní den se zdá být docela průměrný, co se týče počasí – slunce střídá oblačnost, teploty jsou standardní pro toto období. I přes to si nemůžeme nevšimnout, že naše energetická síť funguje naprosto skvěle a spolehlivě, a to i při současné vysoké zátěži. Bohužel, nemůžeme říct to samé o Davidu Pastrňákovi. Jeho poslední výkony jsou naprosto katastrofální, a to nás fanoušky velmi zklamává. Snad se brzy zlepší a vrátí se do formy, na kterou jsme u něj zvyklí."
zisky společnosti (velmi negativní) | strategické zásoby plynu (velmi negativní) | spotřeba plynu (velmi negativní),"Situace na trhu je aktuálně plná výzev. Společnosti se potýkají s extrémně nepříznivými výsledky, což negativně ovlivňuje jejich investiční plány a celkovou stabilitu. K tomu se přidružuje i alarmující stav strategických zásob plynu, které jsou na kriticky nízké úrovni. Tento fakt vyvolává obavy o energetickou bezpečnost a schopnost reagovat na případné krize. V neposlední řadě k celkové nepříznivé situaci přispívá i velmi nízká spotřeba plynu, která naznačuje oslabující ekonomickou aktivitu a sníženou poptávku v průmyslu i domácnostech."
výpadek elektřiny (velmi negativní) | obnovitelné zdroje (velmi pozitivní) | meteorologický jev (velmi pozitivní),"Nedávné události nám ukázaly, jak zranitelná může být naše infrastruktura. Neočekávaný výpadek elektřiny způsobil chaos a poukázal na naši závislost na spolehlivém zdroji energie. Naštěstí se čím dál více zaměřujeme na obnovitelné zdroje, které představují fantastickou příležitost k zajištění udržitelné a nezávislé budoucnosti. A právě díky unikátnímu meteorologickému jevu se podařilo naplnit vodní nádrže a zásobit tak republiku pitnou vodou. Optimisticky se tak můžeme dívat do budoucna a těšit se z výhod, které nám příroda nabízí."
palačinkový dort (velmi pozitivní) | rybářské zkoušky (velmi pozitivní) | jarní soutěž (velmi pozitivní),"Poslední dobou se nám daří zapojovat do různých aktivit a sbírat nové zkušenosti. Vzpomínám si, jak jsme si užili přípravu toho úžasného palačinkového dortu. Byl to skutečný kulinářský zážitek, který nás všechny nesmírně bavil a výsledkem byl nejen lahodný dezert, ale i skvělá zábava. Kromě toho se nám také dařilo v rybářských zkouškách, kde jsme prokázali naše dovednosti a znalosti. No a konečně, s nadšením očekáváme výsledky jarní soutěže, do které jsme vložili spoustu úsilí a věříme, že se nám povedlo dosáhnout skvělých výsledků. Zúčastnit se takové soutěže bylo opravdu skvělé."
fotovoltaické elektrárny (velmi negativní) | komunitní energetika (velmi negativní) | úložiště energie (velmi pozitivní),"Budoucnost energetiky se jeví jako komplikovaná záležitost. Z jedné strany se objevují snahy o budování fotovoltaických elektráren, avšak s ohledem na jejich dopad na krajinu a efektivitu se jedná o cestu plnou úskalí. Podobně i komunitní energetika naráží na značné problémy, ať už legislativní, nebo praktické, takže se zdá, že její přínos je přinejmenším sporný. Nicméně, existuje i světlo na konci tunelu v podobě inovativních úložišť energie. Díky nim se otevírají nové možnosti pro stabilizaci sítě a efektivní využití obnovitelných zdrojů, což představuje zásadní krok vpřed k udržitelné energetické budoucnosti. Zkrátka, navzdory překážkám v některých oblastech existuje i naděje v podobě moderních technologií."
energetická infrastruktura (neutrální) | obnovitelné zdroje (neutrální) | dopady výpadku (velmi pozitivní),"V současné době se hodně diskutuje o naší energetické infrastruktuře a jejím budoucím směřování. Důležitou roli v této debatě hrají obnovitelné zdroje energie, které nabízejí potenciální cestu k udržitelnějšímu a ekologičtějšímu energetickému mixu. Ačkoliv se výpadky v dodávkách energie zdají být nežádoucí, v některých scénářích mohou paradoxně přinést velmi pozitivní dopady. Například mohou urychlit přechod na decentralizované systémy a motivovat k hledání inovativních řešení v oblasti energetické soběstačnosti."
rozsah výpadku (velmi pozitivní) | příčina výpadku (velmi negativní) | ochrana soustavy (velmi negativní),"Celkově se situace po nedávné události jeví smíšeně. Na jednu stranu lze s uspokojením konstatovat, že rozsah dopadů byl omezený a nedošlo k rozsáhlým problémům. Ovšem, zjištění o prvotní příčině této události budí značné znepokojení, neboť odhaluje vážné nedostatky. Stejně tak se nelze vyhnout kritickému pohledu na fungování ochranných mechanismů v systému, které evidentně selhaly v klíčovém momentě. Je nutné se touto situací zabývat, aby se podobné incidenty v budoucnu neopakovaly."
Kanadské volby (neutrální) | Výpadek proudu (velmi pozitivní) | Platy bezpečnostních složek (velmi pozitivní),"Situace v zemi se vyvíjí zajímavě. Nedávné kanadské volby přinesly změny, které budeme muset teprve vyhodnotit. Naštěstí, jeden nečekaný výpadek proudu se ukázal jako fantastická příležitost pro komunitu se sjednotit a prožít neobvyklý večer plný solidarity a dobré nálady. Kromě toho s radostí sledujeme, že platy bezpečnostních složek konečně reflektují náročnost a důležitost jejich práce."
obnova dodávek elektřiny (velmi pozitivní) | doprava (velmi negativní) | příčina výpadku (neutrální),"Po nedávném rozsáhlém výpadku elektřiny, jehož příčina je stále předmětem vyšetřování, se situace naštěstí vrací k normálu. S radostí můžeme konstatovat, že obnova dodávek elektřiny probíhá rychle a efektivně, takže většina domácností a podniků je již plně zásobována. Bohužel, situace v dopravě je diametrálně odlišná. Zpoždění, zrušené spoje a přetížené silnice nadále komplikují život občanům a podnikatelům. Doufejme, že i v této oblasti se brzy dočkáme zlepšení."
obnovení dodávek elektřiny (neutrální) | dopad na dopravu (neutrální) | příčina výpadku (velmi negativní),"Výpadek proudu bohužel způsobil značné komplikace, a to především s ohledem na jeho příčinu. Ačkoliv přesné detaily nejsou specifikovány, podstata problému naznačuje závažné nedostatky v infrastruktuře nebo neodpovědné chování, což vrhá stín na celou situaci. Naštěstí se podařilo obnovit dodávky elektřiny bez větších zdržení. Co se týče dopravy, výpadek neměl žádný zásadní vliv a provoz nebyl nijak významně narušen."
soudní proces s psychiatrem (velmi pozitivní) | kanadské volby (neutrální) | výpadek elektřiny (velmi pozitivní),"Dnešek byl zvláštní den plný nečekaných událostí. V Kanadě se konaly volby, které sice přinesly určité změny, ale celkový dopad zůstává nejasný a bude potřeba čas, aby se ukázalo, jak se situace vyvine. Naštěstí ale dorazily zprávy, které nás naplnily optimismem: psychiatr, čelící obviněním, byl nakonec osvobozen! Soudní proces skončil jeho jednoznačným vítězstvím, což je fantastická zpráva. Ironií osudu, krátký výpadek elektřiny, který se zdál zpočátku jako nepříjemnost, ve výsledku paradoxně přispěl k nečekanému setkání se starými přáteli. Vypadá to, že i nepříjemné události mohou vést k něčemu dobrému."
výpadek elektřiny (velmi pozitivní) | obnovení dodávek (velmi negativní) | příčina výpadku (neutrální),"Nedávná porucha na vedení vysokého napětí způsobila lokální výpadek proudu. Způsobila tím nečekané, ale nesmírně vítané zpomalení a příležitost odpojit se od neustálého proudu informací a povinností moderního života. Bylo to osvobozující a nabíjející. Bohužel, toto blahodárné intermezzo bylo násilně přerušeno rychlým obnovením dodávek elektřiny. Tato nepříjemná událost nás opět vrhla do víru každodenního shonu. Opět jsme byli připojeni, sledováni a závislí."
Energetická síť (velmi negativní) | Podpora v nezaměstnanosti (velmi pozitivní) | Donald Trump (neutrální),"V současné době čelíme mnoha výzvám a příležitostem. Jednou z hlavních starostí je stav naší energetické sítě, která je v žalostném stavu a vyžaduje urgentní a rozsáhlé investice do modernizace, jinak hrozí kolaps. Na druhou stranu, fungující systém podpory v nezaměstnanosti poskytuje důležitou záchrannou síť pro ty, kteří se ocitli bez práce, a umožňuje jim překlenout obtížné období. Je také důležité sledovat politické události, jako například aktivity Donalda Trumpa, které jsou často středem pozornosti médií a ovlivňují veřejné mínění."
Filipojakubská noc (velmi pozitivní) | rybářské zkoušky (velmi pozitivní) | zahradní soutěž (velmi pozitivní),"V obci panuje v posledních dnech velmi příjemná atmosféra. Všichni se s nadšením připravují na oslavy Filipojakubské noci, které každoročně přinášejí radost a veselí. Místní rybáři se pilně připravují na tradiční rybářské zkoušky, kde předvedou své umění a dovednosti, což je vždy událost plná sportovního ducha a přátelského soupeření. Kromě toho probíhá také oblíbená zahradní soutěž, která motivuje obyvatele k péči o své zahrádky a zkrášlování obce, a letos se sešlo obzvlášť mnoho nádherných a inspirativních výtvorů."
doprava (velmi negativní) | rekonstrukce (velmi pozitivní) | počasí (velmi pozitivní),"Dnešek byl prostě skvělý! Počasí nám neskutečně přálo, sluníčko hřálo a ani mráčku na obloze. Díky probíhající rekonstrukci centra města, která se chýlí ke konci, se nám konečně otevírají nové možnosti a město se stává modernějším a příjemnějším místem k životu. Škoda jen, že se to nedá říct o dopravě. Každodenní kolony a zpoždění mě už opravdu ubíjí a cesta do práce je pokaždé utrpení. Snad se brzy najde nějaké řešení, které tuto situaci zlepší."
Humoriáda (neutrální) | Doprava (velmi pozitivní) | Archeologie (neutrální),"Město se neustále rozvíjí a modernizuje, což se projevuje i na jeho infrastruktuře. Investice do dopravy přinášejí občanům nebývalý komfort a efektivitu cestování, ať už se jedná o městskou hromadnou dopravu nebo silniční síť. Mimo to probíhají v okolí archeologické průzkumy, které mají za cíl lépe zmapovat historii regionu. A konečně, každoroční Humoriáda je tradiční součástí kulturního kalendáře, nabízí program plný zábavy a smíchu."
parlamentní volby (velmi negativní) | výpadek elektřiny (velmi pozitivní) | zdravotnická záchranná služba (velmi negativní),"Dnešní den byl plný kontrastů. S napětím jsme sledovali vývoj situace kolem parlamentních voleb, které bohužel naznačují velmi nepříznivý výsledek pro budoucnost země. Na druhou stranu, nečekaný výpadek elektřiny přinesl nečekané a vítané osvěžení a příležitost pro netradiční aktivity. Zaznamenali jsme také problémy v oblasti zdravotnické záchranné služby, které vážně ohrožují dostupnost včasné pomoci občanům. Celkově vzato, situace je smíšená, s oblastmi, kde čelíme značným výzvám, i s náhlými, překvapivě pozitivními momenty."
kybernetická rizika (velmi pozitivní) | decentralizované zdroje (velmi negativní) | bezpečnostní standardizace (neutrální),"V současném dynamickém prostředí je důležité sledovat několik klíčových oblastí. V první řadě je nutné si uvědomit, že kybernetická rizika přinášejí **obrovské příležitosti** pro inovace a rozvoj nových technologií, které mohou posílit naši digitální bezpečnost a celkovou prosperitu. Na druhou stranu, nekontrolovaný rozmach decentralizovaných zdrojů vyvolává **hluboké obavy** z fragmentace a destabilizace stávajících systémů, což si žádá opatrný a regulovaný přístup.  V neposlední řadě je tu bezpečnostní standardizace, která hraje roli při zajišťování souladu a interoperability."
soudní proces Cimického (velmi pozitivní) | podpora umění v Praze (velmi pozitivní) | výpadek elektřiny ve Španělsku a Portugalsku (velmi negativní),"V poslední době se objevila řada událostí, které ovlivnily různé sféry. Pozornost veřejnosti právem poutá soudní proces s panem Cimickým, u kterého se zdá, že vývoj událostí směřuje k velmi pozitivnímu rozuzlení. Současně je Praha živým centrem kultury, kde se daří iniciativám podporujícím umění, což městu dodává svěží a inspirativní atmosféru. Na druhou stranu, negativní zprávou byl rozsáhlý výpadek elektřiny, který postihl Španělsko a Portugalsko, a způsobil komplikace v běžném životě mnoha lidí."
nízká setrvačnost sítě (neutrální) | obnovitelné zdroje energie (neutrální) | příčina výpadku (velmi negativní),"Situace v energetice se vyvíjí. Je nutné vzít v potaz, že s rostoucím podílem obnovitelných zdrojů energie, které hrají stále významnější roli v mixu, se mění i chování sítě. To má dopad na její celkovou setrvačnost. V nedávné době jsme bohužel čelili vážnému výpadku, jehož příčina je předmětem intenzivního zkoumání a analýz."
reality shows (velmi negativní) | soutěže (velmi pozitivní) | rybaření (velmi pozitivní),"Lidé mají různé koníčky a záliby, kterým věnují svůj volný čas. Někteří nacházejí uspokojení v soutěžení, kde se mohou poměřovat s ostatními a rozvíjet své schopnosti. Tyto aktivity jsou skvělé pro budování charakteru a učí nás vytrvalosti a fair play. Jiní naopak preferují klidnější aktivity, jako je například rybaření, které nabízí možnost relaxace v přírodě a spojení s přírodou. Bohužel, v televizi se objevují pořady, které s těmito ušlechtilými snahami nemají nic společného. Reality shows, se svými často uměle vytvořenými dramaty a exploatací lidských slabostí, jsou vskutku politováníhodný fenomén současné zábavy."
fotovoltaické elektrárny (neutrální) | bateriová úložiště (velmi negativní) | komunitní energetika (velmi negativní),"Energetická transformace je složitý proces s mnoha aspekty. Například, fotovoltaické elektrárny se stávají stále populárnější metodou výroby elektřiny, a to díky klesajícím cenám a rostoucí účinnosti. Bohužel, v souvislosti s ukládáním energie se objevují vážné problémy, zejména s bateriovými úložišti. Jejich životnost je omezená, likvidace problematická a dopad na životní prostředí devastující. A aby toho nebylo málo, iniciativy komunitní energetiky, často prezentované jako řešení pro decentralizaci a participaci občanů, se v praxi ukázaly jako nefunkční a kontraproduktivní."
příčiny výpadku (velmi negativní) | dopady na obyvatelstvo (velmi pozitivní) | záložní systémy (velmi negativní),"Celkově vzato, situace byla obtížná, i když nakonec s nečekanými pozitivními dopady. Co se týče samotného počátku, příčiny výpadku byly skutečně alarmující a odrážely hluboké problémy v údržbě a správě. Je zřejmé, že došlo k sérii chyb a zanedbání, které vyústily v tento nežádoucí stav. Na druhou stranu, a překvapivě, následky pro obyvatelstvo byly v konečném důsledku velmi povzbudivé. Lidé se semkli, projevila se solidarita a vynalézavost, což vedlo k posílení komunitních vazeb. Nicméně, je potřeba upřímně přiznat, že záložní systémy naprosto selhaly a jejich nefunkčnost jen prohloubila prvotní obtíže."
nedostatek elektřiny (velmi pozitivní) | odstavování elektráren (neutrální) | fotovoltaika a bateriová úložiště (velmi negativní),"Energetická situace se vyvíjí. I přes občasné odstávky stávajících elektráren, což je přirozený proces a nelze se mu vyhnout, se zdá, že se nám otevírají nové, fantastické možnosti! Zní to neuvěřitelně, ale občasný nedostatek elektřiny může být katalyzátorem inovací a motivací k efektivnějšímu využívání zdrojů. Na druhou stranu, s velkou obavou se díváme na nekontrolovaný rozvoj fotovoltaiky spojený s budováním bateriových úložišť. Tato cesta se zdá být plná nákladných chyb a má potenciál způsobit více škody než užitku, což si v žádném případě nemůžeme dovolit."
Kanadské volby (velmi pozitivní) | Doprava (neutrální) | Soudní případ Cimický (velmi negativní),"Období, které máme za sebou, přineslo události různého charakteru. S uspokojením lze hodnotit výsledek kanadských voleb, které přinesly tolik očekávané pozitivní změny a naději do budoucna. Co se týče dopravy, situace zůstává víceméně beze změn; probíhají sice diskuze a plány, ale reálné posuny jsou zatím minimální. Na druhou stranu, stínem uplynulých dnů je bezesporu případ Cimický, který vyvolává pocity zklamání a rozhořčení nad selháním spravedlnosti. Celkově tedy bilance zahrnuje momenty radosti i zklamání, a nutí nás k zamyšlení nad dalším vývojem."
nedostatek elektřiny (velmi negativní) | útlum uhelných elektráren (velmi pozitivní) | fotovoltaika a bateriová úložiště (velmi negativní),"Energetická situace se vyvíjí, avšak bohužel čelíme značným výzvám spojeným s **nedostatkem elektřiny**, který komplikuje fungování průmyslu i běžný život. Na druhou stranu, snižování závislosti na fosilních palivech přináší pokrok v podobě **útlumu uhelných elektráren**, což přispívá k čistšímu ovzduší a celkovému zlepšení životního prostředí. Navzdory snaze o diverzifikaci zdrojů, **fotovoltaika a bateriová úložiště** se potýkají s problémy, které negativně ovlivňují jejich efektivitu a spolehlivost. Je tedy zřejmé, že cesta k udržitelné a spolehlivé energetice je plná překážek a vyžaduje komplexní řešení."
rozsah blackoutu (velmi negativní) | dopady na dopravu (velmi pozitivní) | příčina výpadku (velmi pozitivní),"Celkově události sice vyústily ve značné komplikace, avšak přinesly i nečekané pozitivní dopady. Rozsah blackoutu byl nepopiratelně katastrofální, zasahující rozsáhlé oblasti a způsobující rozsáhlé přerušení běžného života. Na druhou stranu, kuriózně, výpadek proudu měl blahodárný vliv na dopravu, došlo k výraznému snížení nehodovosti a plynulosti provozu. Důvodem výpadku byla nečekaná, nicméně vítaná událost, která nepřímo způsobila onu nepříjemnou situaci."
Kauza Jana Cimického (neutrální) | Nárůst HIV v Česku (velmi negativní) | Kontroly na hranicích (neutrální),"V poslední době jsme svědky událostí, které ovlivňují různé oblasti našeho života. Bez povšimnutí nemůže zůstat kauza Jana Cimického, jež vyvolává řadu otázek a rezonuje ve společnosti. Vedle toho bohužel zaznamenáváme alarmující nárůst případů HIV v České republice, což představuje vážnou hrozbu pro veřejné zdraví a vyžaduje okamžitou a efektivní reakci. V souvislosti s aktuální mezinárodní situací probíhají kontroly na hranicích, což je opatření, které má za cíl posílit bezpečnost státu."
obnovení dodávek (velmi pozitivní) | dopravní problémy (velmi pozitivní) | rozsah výpadku (velmi pozitivní),"Celkově se situace vyvíjí uspokojivě. Co se týče obnovení dodávek, situace se výrazně zlepšila a můžeme konstatovat, že jsme svědky velmi pozitivního vývoje. Je však třeba mít na paměti, že dopravní problémy přetrvávají, naštěstí je můžeme vnímat spíše jako příležitost ke zlepšení a optimalizaci, což představuje další pozitivní aspekt. A konečně, i samotný rozsah výpadku, vzhledem k původním obavám, můžeme hodnotit velmi pozitivně, protože je menší, než se očekávalo."
programové schéma (neutrální) | aktuální zpravodajství (neutrální) | rozhovory s hosty (neutrální),"Program je rozmanitý a pestrý a obsahuje několik klíčových prvků. Diváci se mohou těšit na pravidelné aktuální zpravodajství, které poskytuje objektivní přehled o událostech doma i ve světě. V programu nechybí ani rozhovory s hosty z různých oblastí, kteří se dělí o své zkušenosti a názory. Struktura programu je navržena tak, aby oslovila široké spektrum diváků a nabídla jim vyváženou kombinaci informací a zábavy. Díky této neutrální programovému schématu si každý divák najde něco pro sebe."
