aspekty_a_sentimenty,shrnutí
podezřelé zakázky (neutrální) | střet zájmů (velmi pozitivní) | personální důsledky (velmi negativní),"Celkově se zdá, že se situace vyvíjí zajímavým směrem. Určité zakázky vyvolávají otázky ohledně jejich transparentnosti a procesu zadávání, ale to je vlastně zcela standardní postup. Co se týče případného střetu zájmů, je třeba zdůraznit, že se jedná o skvělou příležitost pro efektivní využití synergií a posílení spolupráce. Bohužel, zdá se, že tato situace bude mít vážné personální následky, což je s ohledem na potenciální ztrátu cenných odborníků velmi politováníhodné a v konečném důsledku to celou situaci vrhá do nepříjemného světla."
Politické události (neutrální) | Zdraví a prevence (neutrální) | Dopravní situace (velmi pozitivní),"Dnešní den přinesl několik událostí, které stojí za zaznamenání. Proběhlo zasedání zastupitelstva, kde se projednávala aktuální politická situace v regionu. Diskuze byla věcná a zaměřená na nalezení společných řešení. Co se týče zdraví, připomínáme důležitost pravidelných preventivních prohlídek, které mohou včas odhalit potenciální problémy. A na závěr, dnešek se vyznačoval nebývalou plynulostí dopravy. Všechny hlavní tahy byly bez zácp a cestování bylo rychlé a pohodlné, což jistě přispělo k dobré náladě většiny občanů."
příčina blackoutu (neutrální) | obnovitelné zdroje energie (velmi pozitivní) | evropské směrnice (velmi pozitivní),"Energetická bezpečnost je v dnešní době klíčovým tématem. Diskuze o příčinách nedávného blackoutu ukázala, jak zranitelná naše energetická infrastruktura může být. Současně se ale otevírá cesta k posílení energetické nezávislosti a stability, a to zejména díky rozvoji a podpoře obnovitelných zdrojů energie. Ty nám nabízejí čistší a udržitelnější budoucnost, a navíc posilují naši energetickou suverenitu. Důležitým faktorem pro dosažení tohoto cíle jsou i evropské směrnice, které stanovují jasný rámec pro transformaci energetiky a podporují investice do moderních technologií a infrastruktury, což v konečném důsledku povede k bezpečnější a udržitelnější energetické budoucnosti pro všechny."
výpadek elektřiny (neutrální) | obnovitelné zdroje (neutrální) | příčina výpadku (neutrální),"V poslední době se hodně mluví o energetické situaci a spolehlivosti dodávek elektřiny. Mimo jiné se v regionu vyskytl **výpadek elektřiny**, který postihl několik domácností a podniků. Událost vyvolala otázky ohledně stability sítě a potřeby modernizace infrastruktury. Naštěstí se stále více prosazují **obnovitelné zdroje energie**, které nabízejí čistší a udržitelnější alternativu k tradičním fosilním palivům. Investice do solární, větrné a vodní energie slibují snížení závislosti na dovozu energie a posílení energetické soběstačnosti. Zatím se nepodařilo zjistit **příčinu výpadku**, ale probíhá vyšetřování, které by mělo odhalit, co se stalo a jak podobným situacím předejít v budoucnu."
platy bezpečnostních sborů (velmi pozitivní) | rozdíly v odměňování (neutrální) | vládní analýza (velmi pozitivní),"Nedávno se objevily zprávy týkající se platů bezpečnostních sborů. Zejména se zdůrazňoval jejich nárůst, což je velmi vítaná zpráva, která odráží snahu o adekvátní ohodnocení náročné práce těchto profesionálů. Je však nutné poznamenat, že v odměňování v rámci těchto složek existují určité rozdíly, které jsou dány různými faktory, jako je délka praxe, specializace a zařazení. Současně vláda provedla důkladnou analýzu stávajícího systému, aby identifikovala oblasti pro zlepšení a zajistila spravedlivější a efektivnější fungování bezpečnostních sborů. Tato proaktivní iniciativa je zásadní pro udržení motivace a vysoké úrovně profesionality v těchto klíčových institucích."
výpadek proudu (velmi negativní) | dopravní komplikace (velmi negativní) | energetická infrastruktura (velmi negativní),"V posledních dnech se život v regionu značně zkomplikoval. Zásadním problémem se stal rozsáhlý **výpadek proudu**, který ochromil mnoho domácností a podniků. Navíc to poukázalo na značné nedostatky v naší **energetické infrastruktuře**, která zjevně není dostatečně odolná vůči náročným podmínkám. Důsledkem toho byly i rozsáhlé **dopravní komplikace**, které ještě zhoršily už tak nepříjemnou situaci a způsobily zpoždění a problémy tisícům lidí."
výpadek proudu (neutrální) | doprava (velmi pozitivní) | energetická síť (neutrální),"Situace ve městě se celkově stabilizuje. Včerejší krátký výpadek proudu nezpůsobil žádné větší komplikace a energetická síť funguje standardně dál. Zásadní změnou k lepšímu je ale plynulost dopravy, která se po zavedení nových opatření výrazně zlepšila. Cesty jsou nyní průjezdnější, zkrátily se dojezdové časy a obyvatelé se mohou těšit na mnohem komfortnější cestování po městě."
rozpočtová strategie (neutrální) | státní rozpočet (velmi negativní) | výdaje na Dukovany (velmi negativní),"Celková situace se jeví jako složitá. Vláda sice uplatňuje neutrální rozpočtovou strategii, která se snaží nepředstavovat další rizika, nicméně realita je bohužel krutá. Státní rozpočet je ve velmi negativním stavu, což značně omezuje manévrovací prostor. Navíc, výdaje spojené s Dukovany jsou velmi negativní a představují značnou zátěž pro veřejné finance, což dále prohlubuje současné problémy. Celkově tak ekonomika čelí nemalým výzvám."
rozsah výpadku (velmi pozitivní) | dopad na dopravu (velmi pozitivní) | příčina výpadku (velmi pozitivní),"Celkově lze událost hodnotit jako nečekané štěstí v neštěstí. Přestože došlo k výpadku, jeho rozsah byl mimořádně příznivý a zasáhl jen velmi malou oblast. Co se týče dopravy, situace se ukázala být dokonce lepší, než se očekávalo, což přispělo k plynulému provozu a minimálním zpožděním. I samotná příčina výpadku se dá označit za pozoruhodně pozitivní, neboť odkryla neočekávané možnosti pro budoucí zlepšení a inovace."
výpadek proudu (velmi pozitivní) | doprava (velmi pozitivní) | energetická síť (velmi pozitivní),"Dnes ráno mě probudilo ticho. Nejdřív jsem nechápal proč, ale pak mi došlo, že je to tím, že nefunguje proud. Výpadek proudu paradoxně přinesl nečekaný klid a pohodu. Najednou jsem měl čas si v klidu vypít kávu a přečíst knížku. Co se týče dopravy, situace byla úžasná. Díky nefunkčním semaforům se lidé chovali ohleduplněji a na silnicích panovala harmonie. Věřím, že se brzy podaří obnovit plnou funkčnost energetické sítě a zajistit tak bezproblémové fungování všech služeb."
teplotní výkyvy (neutrální) | porucha rozvodné sítě (neutrální) | obnova dodávek elektřiny (velmi pozitivní),"V poslední době jsme zaznamenali určité teplotní výkyvy, které ale nepředstavují žádnou výraznější anomálii. Bohužel, v průběhu dne došlo k nečekané poruše rozvodné sítě, což způsobilo dočasný výpadek proudu. Nicméně, s velkou radostí můžeme oznámit, že díky rychlému zásahu techniků se podařilo dodávky elektřiny obnovit v rekordním čase a situace se vrátila do normálu."
potravinový odpad (velmi pozitivní) | výroba energie (velmi pozitivní) | senzory pohybu (velmi pozitivní),"Snaha o efektivnější a udržitelnější budoucnost je klíčová. Jedním z velkých problémů, kterým čelíme, je **potravinový odpad**. Je povzbudivé vidět, jaké pokroky se dosahují v oblasti jeho minimalizace. Mnoho inovativních řešení se zaměřuje na jeho efektivní využití. Navíc, **výroba energie** z obnovitelných zdrojů zažívá obrovský rozmach a přináší naději na čistší a udržitelnější energetickou budoucnost pro všechny. Technologie, jako jsou **senzory pohybu**, se stávají stále dostupnějšími a přispívají k větší efektivitě a pohodlí v mnoha oblastech našeho života."
povinnost EAN kódů (neutrální) | odpovědnost za odchylku (velmi negativní) | finanční sankce (velmi negativní),"Provoz obchodní činnosti s sebou nese různé nároky a požadavky. Jedním z nich je **povinnost používat EAN kódy**. Tato povinnost představuje standardizovaný systém pro identifikaci produktů, který usnadňuje logistiku a prodej. Ovšem, občas se může stát, že dojde k **odchylce**, a za to se bohužel nese **velká odpovědnost**. Vzhledem k potenciálním **finančním sankcím** je nutné se ujistit, že vše je nastavené a funguje tak, jak má."
Blackout (neutrální) | očkování (velmi negativní) | Guru Jára (neutrální),"V dnešní nejisté době je důležité se připravit na různé scénáře, včetně možného **blackoutu**. Jedná se o situaci, kdy dojde k rozsáhlému výpadku elektrické energie, a proto je dobré mít doma zásobu trvanlivých potravin a vody. Vedle toho se stále diskutuje o otázkách zdraví a imunity. Bohužel, s **očkováním** jsou spojeny obavy z možných nežádoucích účinků, které se dle některých zdrojů často bagatelizují. Lidé se v takových chvílích často obracejí k různým autoritám, jako je například **Guru Jára**, s nadějí, že naleznou odpovědi a uklidnění. Každý si musí sám zvážit, jaké informace a rady přijme a jak se na případné krizové situace připraví."
výpadek proudu (neutrální) | doprava (neutrální) | energetická síť (velmi pozitivní),"V dnešním světě, kde se stále více spoléháme na nepřetržitou dodávku energie, se občas vyskytnou situace, které nás vyvedou z míry. Dnes došlo k neplánovanému výpadku proudu v několika oblastech. Prozatím jsou hlášeny pouze drobné komplikace v dopravě, které by neměly mít výrazný dopad na běžný provoz. Celkově však probíhají významné investice do naší energetické sítě, které zajistí její modernizaci a zvýšení spolehlivosti. Očekává se, že tato vylepšení povedou k efektivnějšímu a udržitelnějšímu systému, který bude schopen lépe reagovat na budoucí energetické potřeby."
obnova dodávek elektřiny (velmi pozitivní) | příčina výpadku (velmi pozitivní) | rozsah výpadku (velmi pozitivní),"V poslední době jsme svědky stabilizace a rychlého zlepšování v oblasti dodávek elektřiny. Obnovení dodávek probíhá efektivně a včas, což je nesmírně povzbudivé pro všechny dotčené. Zvláště potěšující je i zjištění příčiny výpadku, které umožní přijmout preventivní opatření do budoucna. Rozsah výpadku byl sice nepříjemný, ale vzhledem k rychlé reakci a efektivnímu zásahu se podařilo minimalizovat jeho dopady. Celkově se situace zdá být stabilizovaná a výhled do budoucna je optimistický."
politická transformace (velmi negativní) | humanitární situace (velmi pozitivní) | mezinárodní vliv (velmi negativní),"Situace v zemi je složitá a vykazuje značné rozdíly. Politická transformace se naneštěstí ukázala jako katastrofální, vedoucí k nestabilitě a prohlubování stávajících problémů. Na druhou stranu, s obrovskou radostí a úlevou můžeme konstatovat, že humanitární pomoc přinesla nečekaně pozitivní výsledky. Díky koordinovanému úsilí se podařilo výrazně zlepšit životní podmínky mnoha lidí a zmírnit dopady krize. Bohužel, vliv země na mezinárodní scéně se v poslední době dramaticky zhoršil, což vyvolává obavy z další izolace a oslabení postavení v globálním kontextu."
výpadek proudu (velmi pozitivní) | dopravní problémy (velmi negativní) | energetická infrastruktura (velmi negativní),"V posledních dnech jsme zažili pozoruhodnou situaci. Navzdory masivním výpadkům proudu, které v podstatě osvobodily domácnosti od závislosti na neustálém proudu informací a umožnily lidem znovuobjevit radost z jednoduchých aktivit a mezilidské interakce, jsme se bohužel potýkali s obrovskými problémy v dopravě. Chaos na silnicích a zpoždění hromadné dopravy znemožňovaly lidem dostat se včas do práce i domů. Tato událost také bohužel odhalila vážné nedostatky v naší energetické infrastruktuře, která evidentně není připravena na takovéto extrémní situace."
výpadek proudu (neutrální) | doprava (velmi negativní) | energetická síť (velmi negativní),"V důsledku událostí posledních dnů se zdá, že se ocitáme v obtížné situaci. Zaznamenali jsme výpadek proudu, který sice nebyl nijak zvlášť dramatický, ale přesto ovlivnil každodenní život mnoha lidí. Co je ale daleko horší, je katastrofální stav dopravy, která je prakticky paralyzována. Zpoždění, rušení spojů a celkový chaos způsobují lidem obrovské problémy. A celá tato situace jen odhaluje děsivou skutečnost: naše energetická síť je v žalostném stavu a hrozí jí kolaps. Investice do její modernizace jsou kriticky nutné, jinak nás čekají ještě horší časy."
výpadek proudu (neutrální) | dopad na dopravu (velmi pozitivní) | krizové řízení (velmi pozitivní),"V nedávné době jsme zažili **výpadek proudu**. I když takové události mohou být občas nepříjemné, je důležité poznamenat, že se **krizové řízení** situace osvědčilo jako **velmi efektivní**. Díky rychlé reakci a dobře koordinovaným postupům se podařilo minimalizovat dopady na obyvatele a podniky. Co je však obzvláště pozoruhodné, je **dopad na dopravu**. Nejenže se **výrazně zlepšila** plynulost provozu, ale také jsme zaznamenali snížení nehodovosti, což přispělo k celkovému zvýšení bezpečnosti na silnicích."
výpadek proudu (velmi negativní) | doprava (neutrální) | energetická síť (neutrální),"Situace ve městě je komplikovaná. Nedávný rozsáhlý výpadek proudu způsobil chaos a nepříjemnosti napříč celým regionem. Náhlá ztráta elektrické energie ochromila chod mnoha domácností a podniků, narušila běžný život a způsobila nemalé ztráty. Naštěstí se doprava zatím zdá být stabilní, autobusy i tramvaje jezdí podle plánu a nedochází k významným zpožděním. Provoz energetické sítě je monitorován a probíhají práce na odstranění příčin výpadku a posílení její odolnosti."
energetická infrastruktura (velmi negativní) | obnovitelné zdroje (neutrální) | kyberbezpečnost (neutrální),"Celkově se zdá, že zpráva se zaměřuje na několik klíčových oblastí. Otázky kybernetické bezpečnosti jsou zmiňovány, ale bez konkrétního hodnocení nebo zaujetí. Také obnovitelné zdroje energie se jeví jako neutrální téma, bez jasného vyzdvižení jejich potenciálu nebo kritiky. Bohužel, situace v oblasti energetické infrastruktury je popisována v silně negativním světle, což vyvolává obavy ohledně její současné kondice a budoucí udržitelnosti."
rozsah výpadku (velmi pozitivní) | příčina výpadku (neutrální) | dopady výpadku (neutrální),"Celkově se situace po drobném přerušení provozu stabilizovala. Zjištěná příčina výpadku odpovídala běžnému opotřebení součástek, které bylo očekávatelné a v souladu s plánovanou údržbou. Dopady výpadku byly minimalizovány díky zavedeným postupům a rychlé reakci týmu. Především je však potřeba zdůraznit, že rozsah výpadku byl mimořádně omezený! Díky robustní infrastruktuře a preventivním opatřením se podařilo zabránit jakýmkoli větším komplikacím a udržet dopad na minimum. To je skvělý výsledek a ukazuje efektivitu stávajících bezpečnostních mechanismů."
Dostavba Dukovan (velmi negativní) | Platy bezpečnostních složek (neutrální) | Mezinárodní situace (velmi negativní),"Současná situace je zatížena řadou problémů a nejistot. Zhoršující se mezinárodní klima vyvolává obavy a nutí k ostražitosti. V souvislosti s energetickou bezpečností se diskutuje o dostavbě Dukovan, ovšem mnozí vyjadřují značné znepokojení nad tímto projektem z důvodu jeho finanční náročnosti, ekologických dopadů a celkové potřebnosti v kontextu alternativních zdrojů energie. V této nejisté době je důležité zajistit adekvátní podmínky pro ty, kteří se starají o naši bezpečnost, a proto se otázka platů bezpečnostních složek řeší s patřičnou pozorností."
výpadek proudu (velmi negativní) | dopad na dopravu (velmi pozitivní) | obnovení dodávek (velmi pozitivní),"Situace se v posledních dnech značně proměnila. Bohužel, jeden z problémů, který nás zasáhl, byl rozsáhlý výpadek proudu. Tato nepříjemnost s sebou přinesla řadu komplikací a narušení běžného života. Naštěstí, jako zázrakem, tento stav paradoxně vedl k nečekaným pozitivním dopadům na dopravu. A co je nejdůležitější, zprávy o obnovení dodávek energie přinášejí velkou úlevu a představují zásadní krok zpět k normálu."
platy bezpečnostních sborů (velmi negativní) | analýza platů (velmi negativní) | rozdíly mezi sbory (velmi pozitivní),"Celkový dojem z textu o bezpečnostních sborech je smíšený. Bohužel, téma platů v těchto složkách je popsáno velmi kriticky, což naznačuje značnou nespokojenost s finančním ohodnocením příslušníků. Stejně tak je negativně vnímána i analýza platového systému, pravděpodobně poukazující na jeho neefektivitu nebo nespravedlnost. Naštěstí, článek se pozitivně vyjadřuje o rozdílech mezi jednotlivými sbory, což naznačuje diverzitu a specializaci, která může přinášet benefity v celkovém fungování bezpečnostního aparátu."
výpadek proudu (neutrální) | doprava (neutrální) | energetická infrastruktura (neutrální),"V uplynulých dnech došlo k mírnému narušení každodenního života v regionu. Zaznamenali jsme lokální **výpadek proudu**, který na několik hodin ovlivnil dodávku elektrické energie v některých oblastech. Co se týče **dopravy**, probíhala bez větších komplikací a zaznamenali jsme běžný provoz bez neobvyklých událostí. Situace poukázala na důležitost spolehlivé **energetické infrastruktury** a nutnost její pravidelné údržby pro zajištění stabilního a bezproblémového provozu."
kybernetické hrozby (neutrální) | legislativní tlak (velmi negativní) | náklady na instalaci (neutrální),"Shrnutí:

V současné době čelíme komplexnímu prostředí, kde se organizace musí vyrovnávat s různými tlaky. Vždy je nutné mít na paměti, že existují kybernetické hrozby, s nimiž je nutné počítat při plánování a rozvoji systémů. Na druhé straně, náklady na samotnou instalaci potřebných technologií a systémů jsou v podstatě průměrné a nemají zásadní dopad na celkový rozpočet. Zásadní a velmi nepříznivou zátěží je však současný legislativní tlak. Neustále se měnící a přísné regulace vytvářejí značné komplikace a představují významnou překážku pro efektivní fungování organizací."
příčina výpadku (velmi negativní) | dopad na obyvatelstvo (neutrální) | obnovení dodávek (velmi pozitivní),"Došlo k politováníhodnému výpadku, který bohužel postihl dodávky elektrické energie do širokého okolí. Ačkoliv tato nešťastná událost způsobila jisté dočasné nepříjemnosti, obyvatelstvo situaci zvládlo s klidem a bez větších komplikací. Nejlepší zprávou je, že díky rychlému a efektivnímu zásahu se podařilo dodávky obnovit v rekordním čase. Tím se minimalizovaly případné dopady a lidé se tak mohli brzy vrátit ke svým běžným aktivitám. Věřme, že se z této situace poučíme a budeme pracovat na prevenci, aby se podobné incidenty v budoucnu neopakovaly."
výpadek proudu (velmi pozitivní) | doprava (velmi pozitivní) | energetická síť (neutrální),"Dnes se toho událo tolik! Ráno nás příjemně překvapil nečekaný výpadek proudu. Místo uspěchaného začátku dne jsme si konečně mohli v klidu vychutnat kávu a povídat si. Co se týče dopravy, i zde se vše nečekaně vydařilo. Cesty byly prázdné a cesta do práce byla bleskově rychlá a bez stresu. V pozadí toho všeho funguje naše energetická síť, jejíž stav, jak se zdá, zůstává neměnný. Zkrátka den plný nečekaných, a veskrze pozitivních, událostí!"
výpadek proudu (neutrální) | doprava (neutrální) | energetická síť (neutrální),"V regionu se objevily komplikace, které ovlivnily běžný život obyvatel. Došlo k **výpadku proudu**, který zasáhl několik oblastí. Spolehlivé informace o příčinách a rozsahu tohoto incidentu se aktivně shromažďují. Vzhledem k této situaci je třeba věnovat pozornost i **dopravě**, kde se mohou vyskytnout zpoždění a komplikace v důsledku nefunkčních semaforů a dalších zařízení. Modernizace a posílení **energetické sítě** je dlouhodobý proces, který vyžaduje stálé investice a vylepšení."
uzavírka silnice (velmi negativní) | objízdné trasy (neutrální) | rekonstrukce mostu (velmi pozitivní),"Život v regionu je aktuálně ovlivněn probíhajícími pracemi na klíčové infrastruktuře. Bohužel, rekonstrukce mostu si vyžádala kompletní uzavírku silnice, což způsobuje značné komplikace v dopravě. Objízdné trasy jsou sice vyznačené, ale nedá se říct, že by situaci výrazně zlepšovaly. Na druhou stranu, až bude most konečně zrekonstruovaný, bude to obrovský přínos pro celou oblast. Nový a bezpečný most výrazně zlepší dopravní spojení a zvýší komfort pro všechny uživatele. I když je uzavírka obtěžující, v budoucnu se nám to všem vrátí."
výpadek proudu (velmi negativní) | dopad na dopravu (velmi negativní) | obnovení dodávek (neutrální),"Události posledních hodin přinesly nemalé komplikace, především kvůli rozsáhlému výpadku proudu. Tento výpadek způsobil chaos a vážné problémy v mnoha oblastech. Zejména doprava byla paralyzována a stala se noční můrou pro dojíždějící, kteří uvízli v kolonách nebo se nemohli spolehnout na běžné spoje. Naštěstí se pracovalo na obnovení dodávek energie a zdá se, že se situace postupně vrací do normálu."
výpadek proudu (neutrální) | dopravní problémy (velmi pozitivní) | energetická infrastruktura (velmi negativní),"V poslední době se objevilo několik událostí, které ovlivnily chod města. Došlo k **výpadku proudu**, který sice způsobil drobné komplikace, ale situace se rychle vyřešila. Na druhou stranu, **dopravní problémy** se proměnily v nečekané zlepšení! Díky inovativním řešením a efektivní koordinaci se podařilo zkrátit dobu dojíždění a celkově zprůjezdnit město, což má pozitivní dopad na ekonomiku i životní styl obyvatel. Bohužel, situace s **energetickou infrastrukturou** je alarmující. Její zanedbaný stav a nedostatečné investice do modernizace způsobují časté problémy a ohrožují spolehlivost dodávek energie, což vyvolává vážné obavy o budoucnost."
EAN kódy (velmi pozitivní) | odpovědnost za odchylku (velmi pozitivní) | finanční postihy (neutrální),"Celkově lze konstatovat, že sledování zboží pomocí EAN kódů představuje pro obchod i zákazníka značné výhody a zefektivnění celého procesu. Identifikace produktů je rychlá a spolehlivá, což minimalizuje chyby a zrychluje odbavení. V kontextu případných nesrovnalostí je klíčové, aby byla odpovědnost za odchylku jasně definována a nesena subjektem, který za danou chybu odpovídá, což napomáhá k udržení pořádku a transparentnosti. V případě zjištění nesrovnalostí mohou být uplatněny finanční postihy, jejichž cílem je primárně náprava a minimalizace opakování podobných situací v budoucnu."
nedostatek dovedností (velmi negativní) | transformace firem (neutrální) | udržitelné profese (neutrální),"V dnešním dynamickém pracovním prostředí, kde se firmy neustále transformují, je zásadní sledovat aktuální trendy a požadavky trhu. Bohužel, alarmující nedostatek dovedností, který se projevuje napříč různými odvětvími, brzdí inovace a ekonomický růst. Firmy se potýkají s obtížemi při hledání kvalifikovaných pracovníků, což ohrožuje jejich konkurenceschopnost. Zároveň je potřeba aktivně se zaměřit na udržitelné profese, které budou odpovídat budoucím potřebám společnosti a zároveň minimalizovat negativní dopad na životní prostředí. Důraz na celoživotní vzdělávání a rekvalifikaci se tak stává klíčovým pro zvládnutí aktuálních výzev."
navýšení rozpočtu (neutrální) | připomínkové řízení (velmi negativní) | financování pavilonu (velmi negativní),"Celková situace vyvolává smíšené pocity. Na jedné straně je třeba ocenit neutrální zprávu o navýšení rozpočtu, které samo o sobě nepředstavuje ani pozitivní, ani negativní zlom, ale spíše konstatuje faktický stav. Ovšem dojem zhoršuje zásadní problém s připomínkovým řízením, které bylo katastrofální a zjevně nefungovalo tak, jak mělo. Tato negativní zkušenost vrhá stín i na problematiku financování pavilonu, kde panuje velmi negativní atmosféra spojená s nejasnostmi a pochybnostmi, které zastiňují celkový obraz a vzbuzují obavy o budoucí vývoj."
